Assistance,Agency,Address,City,State,Zip,County,Services,Eligibility,Hours,Phone,Website,Latitude,Longitude
"Transitional Housing for Families, Seniors, & Single Adults",DENVER RESCUE MISSION,6090 Smith Rd,Denver,CO,80207,DENVER COUNTY,"Offers 1-year transitional housing for families, married couples, singles and seniors, as well as the following services:Case management On-site computer lab Three meals per day Laundry facilities Spiritual support Life skills workshops Youth development program...","Eligibility: Individuals and families must: Be low income Have verifiable income of $870 for individuals and $1,000 for families is r...","Monday - Friday, 8:30 a.m. - 5 p.m. (Administrati...",(303) 953-3963,http://denverrescuemission.org/who-we-are/locations/the-crossing,39.7753959,-104.9422916
Long-Term Shelter for Single Adults & Families,CATHOLIC CHARITIES LARIMER COUNTY,460 Linden Center Dr,Fort Collins,CO,80524,LARIMER COUNTY,"Provides a year-round, extended stay shelter program. Lengths of stay vary based on client needs and progress toward goals with a case manager (establishing income, building savings, and locating permanent housing), but are generally 4 - 6 months long. Additional...",Eligibility: Applicants must: Be experiencing homelessness Be aged 18 and older Commit to sober living environment Complete an applicat...,"Monday - Friday, 8:30 a.m. - 12 p.m., 1 p.m. - 5...",(970) 493-0141,http://ccdenver.org/larimer,40.5947368,-105.0692106
Family Shelter,HOUSE OF NEIGHBORLY SERVICE,1511 E 11th St,Loveland,CO,80537,LARIMER COUNTY,Provides a day center for families with children who are experiencing homelessness. Families are given resources and assistance with the goal of self-sufficiency...,Eligibility: Families must: Be experiencing homelessnessHave dependent children aged 18 or youngerBe legal residents of the US Area S...,"Monday - Wednesday, 9 a.m. - 4 p.m.; Thursday, 9 ...",(970) 663-1716,http://honservice.org/programs/family-promise-of-larimer-county.html,40.4033803,-105.0564413
Essential Needs Assistance,CROSSROADS MINISTRY OF ESTES PARK,1753 Wildfire Rd,Estes Park,CO,80517,LARIMER COUNTY,Offers limited assistance with basic and emergency needs. Services include: Partial rent or utility bill assistance Prescription assistance Emergency short-term lodging vouchers Bilingual case management Clothing and household goods vouchers Showers or laundry services vouchers Emergency transportation assistanc...,Eligibility: Estes Valley residents with an income that is at or below 50% of the area median income level (AMI) Area Served: Towns o...,"Monday - Thursday, 10 a.m. - 4 p.m.; Friday, 10 a...",(970) 577-0610,http://crossroadsep.org,40.3872371,-105.4903162
Transitional Housing and Support Services,WARREN VILLAGE,1323 Gilpin St,Denver,CO,80218,DENVER COUNTY,"Offers transitional housing to low-income, single-parent families for up to 4 years. Housing options consist of 1-3 bedroom apartments suitable for a parent and up to six children...",Eligibility: Single parents/guardians must:Be aged 18 and older Have custody of at least one child/ multiple children under the age o...,"Monday - Friday, 9 a.m. - 7 p.m.",(303) 321-2345,http://warrenvillage.org,39.7374544,-104.9674456
Transitional Housing,WARREN VILLAGE,1323 Gilpin St,Denver,CO,80218,DENVER COUNTY,Offers safe and affordable housing for young mothers interested in pursing high school diploma or GED in partnership with Florence Crittenton Services and other GED/high school diploma programs...,Eligibility: Must be: Aged 18-24 with custody of at least one and up to three children under 12 years old Enrolled at Florence Critten...,"Monday - Friday, 9 a.m. - 7 p.m.",(303) 320-5080,http://warrenvillage.org,39.7374544,-104.9674456
Community Shelter,HOMEWARD BOUND OF THE GRAND VALLEY,2853 North Ave,Grand Junction,CO,81501,MESA COUNTY,"Provides a safe year-round emergency shelter, meals, and respectful, compassionate services to individuals who are homeless in Mesa County...",Eligibility: Services for individuals experiencing homelessness aged 18 and older Area Served: Mesa County,"Monday - Friday, 9 a.m. - 4 p.m. (Administrative ...",(970) 256-9424,http://www.homewardboundgv.org,39.0768951,-108.5226613
Drop-in Center for Youth,SOX PLACE,2017 Lawrence St,Denver,CO,80205,DENVER COUNTY,Provides a daytime drop-in center offering:A hot meal Snacks Recreation Internet access Clothing Showers Personal hygiene items Crisis intervention Referrals to other resource...,Eligibility: Individuals experiencing homelessness aged 30 years and younger and their children aged 1 years and older. Area Served:...,"Tuesday - Friday, 11 a.m. - 4 p.m.; Saturday, 9 a...",(303) 296-3412,http://soxplace.com,39.7527751,-104.9915678
Transitional Housing,OPEN DOOR MINISTRIES,1530 N Marion St,Denver,CO,80218,DENVER COUNTY,Offers a transitional housing program and supports each individual to establish self-sufficiency through getting a job or enrolling in a school program...,Eligibility: Individuals aged 19 and older that are in a crisis situation Area Served:Statewide,"Monday - Friday, 8:30 a.m. - 4 p.m.",(303) 830-2201,http://odmdenver.org/need-housing,39.7820388,-104.9711284
Mobile Community Services for Single Men and Single Women,CHRIST'S BODY MINISTRIES,850 Lincoln St,Denver,CO,80203,DENVER COUNTY,"Provides, through the usage of mobile trailers and vans, the following services to the community: Hot meals Food assistance Clothing Showers Personal hygiene items Referrals to other agencies Hair cut...",Eligibility: No restrictions applied Area Served:Statewide,Hours Vary,(303) 860-1272,http://christsbody.org,39.7300143,-104.9857543
Temporary Housing for Women,VOLUNTEERS OF AMERICA COLORADO,601 S Irving St,Denver,CO,80219,DENVER COUNTY,Offers temporary housing to single women who experience long time homelessness with mental health issues.,Eligibility: Individuals must:Aged 18 or older Be chronically homeless women (homeless for one continuous year or four times in three...,24 hours/7 days a week (Operating Hours),(303) 934-9501,http://voacolorado.org/gethelp-denvermetro-ryes-irving,39.7056105,-105.0301767
Housing First Program,HOMEWARD PIKES PEAK,2010 E Bijou St,Colorado Springs,CO,80909,EL PASO COUNTY,Housing First provides housing and supportive services for people who suffer from: Mental illness Substance abuse Chronic homelessness Also offers veteran-specific housing for homeless veterans and their families...,Eligibility: Individuals and families amicted by: Chronic homelessness Substance abuse Mental illness Area Served: El Paso County,"Monday - Friday, 8:30 a.m. - 4:30 p.m.",(719) 473-5557,http://homewardpp.org/housing-crst,38.8360787,-104.7913581
Transitional Housing,EMERGENCY FAMILY ASSISTANCE ASSOCIATION,1575 Yarmouth Ave,Boulder,CO,80304,BOULDER COUNTY,Offers a 2 month transitional housing program for single and two-parent families with children.,Eligibility: Single or two-parent families with children who are residents of Boulder County Area Served: Boulder County,"Monday, Wednesday, Friday, 12 p.m. - 4:30 p.m.; T...",(303) 442-3042,http://efaa.org,40.058333,-105.2778705
Rapid Re-Housing,BRIGHT FUTURE FOUNDATION,1060 W Beaver Creek Blvd Suite 201,Avon,CO,81620,EAGLE COUNTY,"Provides a limited number of families with low rent, temporary housing for up to two years after leaving the Safehouse. Program participants also have access to: - Case management - Advocacy - Counseling - Community referrals -Life skills workshops -Childcare assistance -Legal services * Individuals must already be participating in a program with the Bright Future Foundatio...",Eligibility: Anyone who is or has experienced Domestic Violence or Sexual Assault and is a current participant in a Bright Future Fo...,"Monday - Friday, 9:00 am - 5:00 pm (administratio...",(970) 949-7097,http://mybrightfuture.org,39.639707,-106.529458
Supportive Services for Homeless families,POSADA OF PUEBLO,501 Belmont Ave,Pueblo,CO,81004,PUEBLO COUNTY,"Provide referrals to homeless families with children for shelter, basic needs. Review options for low-income housing, identify community resources and programs to obtain self-sufficiency...",Eligibility: Homeless families with children Area Served: Pueblo County,"Monday - Friday, 8 a.m. - 4 p.m. (By Appointment ...",(719) 545-8776,http://www.posadapueblo.org,38.258448,-104.638301
Emergency Utility Assistance,CATHOLIC CHARITIES WELD COUNTY,1442 N 11th Ave,Greeley,CO,80631,WELD COUNTY,Provides emergency electric bill payment assistance to low-income households when funding is available. This assistance is available once in a 12-month period (October - September)...,Eligibility: Applicant must:Be a resident of Weld CountyBe at or below 80% of the Area Median Income (AMI) Have a consistent payment ...,"Monday - Friday, 8:30 a.m. - 4:30 p.m.",(970) 616-8615 (Assistance Hotline),http://ccdenver.org/weld-county-services,40.4501919,-104.6965757
Transitional Housing,WOODLAND PARK COMMUNITY CHURCH,700 Valley View Dr Suite D,Woodland Park,CO,80863,TELLER COUNTY,Provides transitional housing for people who need a temporary home while they get back on their feet.,"Eligibility: Applicants must:Be a resident of Teller County, de`ned as either:Employed in Teller CountyHave",children enrolled in Te...,"Monday - Thursday, 9 a.m. - 12 p.m.",(719) 687-9444,39.0121422,-105.0620232
Severe Cold Weather Motel Vouchers for Families,JEFFERSON COUNTY HUMAN SERVICES,900 Jefferson County Pkwy,Golden,CO,80401,JEFFERSON COUNTY,"Provides motel vouchers to Jefferson County families who are experiencing homelessness, when overnight temperatures are: 32 degrees or colder and wet OR 20 degrees or colder and dry Entry Point Locations:Jefferson County Human Services 900 Jefferson Pkwy,...","Eligibility: Families must have a connection to Jefferson County, either school or benefits, and have dependent accompanying childre...","Monday - Thursday, 7:30 a.m. - 5:30 p.m. (Buildin...",(303) 271-1388,http://headinghomejeffco.com/,39.7320857,-105.210309
"Day Shelter for Single Men, Single Women and Families",HAVEN OF HOPE,1101 W 7th Ave,Denver,CO,80204,DENVER COUNTY,Offers a day shelter serving the homeless and underserved populations. Services include:Meals (breakfast and lunch) Private showers Laundry services Clothing Document and mail safekeeping Free phone access Free wireless internet Travel hygiene packs Food boxes...,Eligibility: Individuals aged 18 years and older Area Served: Statewide,"Monday - Friday, 7 a.m. - 9:30 a.m., 10:30 a.m. -...",(303) 607-0855,http://thoh.org/,39.7274809,-105.0020582
Emergency Shelter for Single Men,SALVATION ARMY DENVER,1901 29th St,Denver,CO,80216,DENVER COUNTY,"Provides emergency overnight shelter for single men. Shelter offers: Dinner and breakfast Showers Laundry Lockers Kennels for dogs, based on availability Weekly bed rental...",Eligibility: Individuals must be aged 21 and older and self-identify as male Area Served:City of Denver,24 hours/7 days a week,(720) 305-4640,http://crossroadscenter.salvationarmy.org,39.7656152,-104.987605
Women and Transgender Women's Overnight Shelter,CATHOLIC CHARITIES OF DENVER,2301 Lawrence St,Denver,CO,80205,DENVER COUNTY,"Provides an emergency shelter for single women on a first-come, first-served basis. Participants are provided with nutritious meals and matched to a Samaritan House facility that best meets their needs...","Eligibility: Women and transgender women aged 18 or older Area Served: Adams, Arapahoe, Boulder, Broomfield, Denver, Douglas, Jeffers...","Monday - Friday, 8:30 a.m. - 5 p.m. (Administrati...",(303) 294-0241,http://ccdenver.org/denver-samaritan-house/,39.7556512,-104.9872002
Women's Shelter,SPRINGS RESCUE MISSION,5 W Las Vegas St,Colorado Springs,CO,80903,EL PASO COUNTY,Provides a shelter for women experiencing homelessness. Pets are allowed but have to be kenneled at the location. This service is on a first come first serve basis...,Eligibility: Women aged 18 years and older who are experiencing homelessness Area Served: El Paso County,"Sunday - Saturday, 8 a.m. - 5 p.m.",(719) 884-2773,http://springsrescuemission.org,38.8184191,-104.8263849
Veteran Transitional Housing Program,MILE HIGH BEHAVIORAL HEALTHCARE,2178 Victor St,Aurora,CO,80045,ADAMS COUNTY,Provides long-term stays of up to two years for veterans experiencing homelessness.,Eligibility: Veterans must: Be a family with children aged 17 years or younger experiencing homelessness Be a single veteran women wit...,"Monday - Friday, 5 p.m. - 7 a.m. (Shelter Hours)",(303) 341-9160,http://comitiscrisiscenter.org/comitis-crisis-center,39.7492153,-104.8329055
Emergency Shelter for Single Men & Single Women,MILE HIGH BEHAVIORAL HEALTHCARE,2178 Victor St,Aurora,CO,80045,ADAMS COUNTY,Provides a 30-day overnight shelter for single adult men and women. Space assignment is determined by a lottery system.,Eligibility: Individuals must be aged 18 years or older and either single men or single women (gender determined by self-identi`cat...,"Monday - Friday, 5 p.m. - 7 a.m. (Shelter Hours)",(303) 341-9160,http://comitiscrisiscenter.org/comitis-crisis-center,39.7492153,-104.8329055
Affordable Housing,MERCY HOUSING,1600 N Broadway Suite 2000,Denver,CO,80202,DENVER COUNTY,"Provides affordable housing, including supportive housing for the formerly homeless, and permanent rentals.",Eligibility: Individuals who are one of the following: Experiencing homelessness A Senior aged 62 and older A low-income family Living w...,"Monday - Thursday, 8:30 a.m. - 5 p.m.",(303) 830-3300,http://mercyhousing.org,39.747357,-104.9874
Employment Services,BRIDGE HOUSE,4747 Table Mesa Dr,Boulder,CO,80305,BOULDER COUNTY,Offers employment services that provide:Paid jobs Vocational trainingSupport servicesStable housing for individuals re-entering the workforc...,Eligibility: Individuals aged 18 and older who are experiencing homelessness Area Served: Boulder County,"Monday - Friday, 10 a.m. - 3 p.m.",(303) 442-8300,http://boulderbridgehouse.org,39.9861746,-105.2372226
Women Veterans Program,VOLUNTEERS OF AMERICA COLORADO,1247 Santa Fe Dr,Denver,CO,80204,DENVER COUNTY,Provides the following services for women Veterans experiencing homelessness or at-risk of experiencing homelessness: Emergency and Transitional Housing Housing Search Assistance Intensive Case Management Employment and Education Assistanc...,Eligibility: Must be: Women Veterans with or without children Transgender and same-sex couples experiencing homelessness Women and tran...,"Monday - Friday, 8 a.m. - 4 p.m. (Administrative ...",(720) 501-3369,http://voacolorado.org/veteran-services-center,39.7362019,-104.9991069
Day Center and Food Pantry,RISING UP,527 State St,Fort Morgan,CO,80701,MORGAN COUNTY,Offers: A self-serve food pantry where individuals can take what is needed/wanted Breakfast and lunch Assistance with job and housing searchesAccess to showers English as a Second Language clas...,Eligibility: Individuals and families experiencing homelessness or food insecurity in the service area Area Served: Morgan County,"Monday - Thursday, 9 a.m. - 4 p.m. (Day Shelter ...",(970) 370-8880,http://risingupmorgancounty.com,40.2520924,-103.8003196
Transitional Housing,HAVEN HOUSE,4806 N River Rd,Olathe,CO,81425,MONTROSE COUNTY,"Provides a transitional housing facility that provides long term shelter, safety and hope for the future to families that otherwise might be homeless...",Eligibility: Families experiencing homelessness in the service area Area Served:Montrose County,"Monday - Friday, 9 a.m. - 5 p.m. (Administrative ...",(970) 323-5280,http://havenhousehomeless.org,38.623647,-107.9878456
Men's Shelter,SPRINGS RESCUE MISSION,5 W Las Vegas St,Colorado Springs,CO,80903,EL PASO COUNTY,Provides a shelter for men experiencing homelessness. Pets are allowed but have to be kenneled at the location. This service is on a first come first serve basis...,Eligibility: Men aged 18 years and older who are experiencing homelessness Area Served: El Paso County,"Sunday - Saturday, 8 a.m. - 5 p.m.",(719) 632-1822,http://springsrescuemission.org,38.8184191,-104.8263849
Homeless Shelter,MEXICAN AMERICAN DEVELOPMENT ASSOCIATION,17 N 6th St,Montrose,CO,81401,MONTROSE COUNTY,"Provides emergency shelter to individuals and families who are homeless. Transportation to the shelter provided by MADA. Arrive at MADA main location, 17 N 6th Street in Montrose between 4:00 pm and 5:00pm...","Eligibility: Individuals Experiencing Homelessness Area Served: Delta, Montrose, Ouray counties","Monday - Friday, 8:00 a.m. - 4:00 p.m.",(970) 249-4774,No Website listed,38.4814246,-107.8857893
Veteran Housing Services,VOLUNTEERS OF AMERICA COLORADO,482 28 Rd,Grand Junction,CO,81501,MESA COUNTY,Provides veterans and their families with the following resources:Case management Temporary financial assistance for security deposits Rent assistance A case manager works with the veteran and their family to,develop a plan toward stable housing...,Eligibility: Veterans aged 18 and older who are homeless or at-risk of homelessness with a discharge status other than dishonorable ...,"Monday - Friday, 8 a.m. - 4 p.m.",(970) 257-3767,39.0748282,-108.5332234
Emergency Rent Assistance,CATHOLIC CHARITIES WELD COUNTY,1442 N 11th Ave,Greeley,CO,80631,WELD COUNTY,Provides emergency rent payment assistance to low-income families and individuals in crisis when funding is available.,Eligibility: Applicant must be:A resident of the City of Greeley At or below 80% of the Area Median Income (AMI) The financially liabl...,"Monday - Friday, 8:30 a.m. - 4:30 p.m.",(970) 616-8615 (Assistance Hotline),http://ccdenver.org/weld-county-services,40.4501919,-104.6965757
Female Senior Shelter,VOLUNTEERS OF AMERICA COLORADO,1247 Santa Fe Dr,Denver,CO,80204,DENVER COUNTY,Provides a shelter with supportive services and housing case management.,"Eligibility: Must be individuals that identify as female who are aged 60 and older Area Served: Adams, Arapahoe, Denver, Douglas coun...","Monday - Friday, 8 a.m. - 4 p.m. (Administrative ...",(720) 234-5195,No Website Listed,39.7362019,-104.9991069
Emergency Overnight Shelter for Women,HAVEN RIDGE,P.O. Box 19589,Boulder,CO,80308,BOULDER COUNTY,Offers an overnight emergency shelter in Boulder County women.,Eligibility: Individuals aged 16 or older that identify as: Female Trans woman Trans man Cis woman Area Served: Statewide,By Appointment Only,(303) 447-9602,http://mother-house.org/lodge,40.0149856,-105.270545
Emergency Shelter for Families,ALMOST HOME,22 S 4th Ave Suite 102,Brighton,CO,80601,ADAMS COUNTY,Provides emergency shelter for families with children for up to 60 days.,Eligibility: Families must:Have children aged 18 and younger or have one pregnant individual Be US Citizens or have legal residency Be...,"Monday, Tuesday, Thursday, 8:30 a.m. - 4:30 p.m.;...",(303) 659-6199,http://almosthomeonline.org/emergency-shelter,39.9864547,-104.8180321
Housing for Pregnant Women and Women with Children,CATHOLIC CHARITIES OF DENVER,6240 Smith Rd,Denver,CO,80207,JEFFERSON COUNTY,"Provides housing and supportive services for pregnant women and women with children, for as long as needed in a communal living environment...","Eligibility: Pregnant women and female-identifying women who: Are aged 18 or older Have children Boys, aged 0 - 12 Girls, any age Have at...","Monday - Sunday, 8 a.m. - 9 p.m.",(720) 799-9400,http://ccdenver.org/marisolservices/marisol-homes/,39.7753959,-104.9422916
Shelter for Single Women,CATHOLIC CHARITIES OF DENVER,4330 E 48th Ave,Denver,CO,80216,DENVER COUNTY,"Offers a shelter for single women on a first-come, first-served basis. Shelter provides: Nutritious meals, 3 times a dayShower and laundry services Case management support Counseling Employment supportConnection to housing referrals and community based resource...","Eligibility: Single women and trans-women aged 18 or older Area Served: Nationwide, Statewide",24 hours/7 days a week (Shelter Operating Hours);...,(720) 799-9506,http://ccdenver.org/colorado-homeless-shelters/,39.7833193,-104.9371448
Transitional Housing,DON'T LOOK BACK CENTER,14211 E 4th Ave Bldg 3 Suite 305,Aurora,CO,80011,ARAPAHOE COUNTY,"Provides transitional housing, including:Recovery coach servicesBasic life skills training Health and wellness classes 12-step relapse prevention programmin...","Eligibility: Must be aged 18 and older and not be a registered sex offender. Area Served: Adams, Arapahoe, Broomfield, Douglas, Denve...","Monday - Friday, 9 a.m. - 5 p.m. (Office Hours); ...",(303) 522-7830,http://thedontlookbackcenter.org/,39.722078,-104.819662
Transitional Housing and Rapid Re-Housing,LOAVES AND FISHES MINISTRIES OF FREMONT COUNTY,241 Justice Center Rd,Cañon City,CO,81212,FREMONT COUNTY,Housing Assessment completed for those experiencing Homelessness. Transitional housing units available on 90 day short term basis or transitional period of time...,Eligibility: Low income individuals and families who were previously homeless Area Served: Canon City,"Monday - Friday, 8 a.m. - 4 p.m.",(719) 275-0593,http://www.lfministries.org,38.4466001,-105.1832613
Emergency Shelter,LOAVES AND FISHES MINISTRIES OF FREMONT COUNTY,241 Justice Center Rd,Cañon City,CO,81212,FREMONT COUNTY,Emergency shelter with 38 beds is available at Chayah House and provided to families and individuals struggling with basic needs.,Eligibility: Low income individuals and families struggling with basic needs Area Served:Canon City,"Monday - Friday, 8 a.m. - 4 p.m.",(719) 275-0593,http://www.lfministries.org,38.4466001,-105.1832613
Transitional Housing Program,KARIS,PO Box 2837,Grand Junction,CO,81502,MESA COUNTY,Provides a two-year transitional housing program for adults 18. Housing includes single rooms with shared bathrooms and kitchen as well as connections to resources and support in the community...,Eligibility: Adults aged 18 or older experiencing homelessness Area Served:Mesa County,"Monday - Friday, 8:00 a.m. - 4:00 p.m. (administr...",(970) 234-7004,http://thehousegj.org,39.0672568,-108.56448
La Puente Services,LA PUENTE FOR THE SAN LUIS VALLEY,403 Maroon Ave,Crested Butte,CO,81224,GUNNSION COUNTY,"La Puente Services offered: -Homeless shelter -Food bank network -Outreach services -Family services - Children's programs -Rethreads, Enterprises, VEGI and Veterans GPD program...",Eligibility: Community member in Crisis or Homeless individuals needing assistance Area Served: Gunnison County,Monday - Friday (8:00 am - 5:00 pm (Administratio...,(970) 349-6405,https://www.ucccrestedbutte.org/outreach/la-puente,38.870736,-106.9839676
Family Shelter,HOMEWARD BOUND OF THE GRAND VALLEY,562 29 Rd,Grand Junction,CO,81504,MESA COUNTY,"Provides food and shelter for needy families experiencing homelessness. Other services include: Onsite healthcare professionals Children's library and play area Recovery living program for those seeking treatment for substance abuse Comprehensive case management, which includes: Trainings and coaching Navigation of resources such as employment applications and public assistance Legal services Program that works to ready guests for entry-level jobs in the communit...",Eligibility:Services for families experiencing homelessness. Area Served:Mesa County,24 hours/7 days a week,(970) 256-9424,http://homewardboundgv.org,39.0865925,-108.5145129
Supportive Housing for Youth,URBAN PEAK,2100 Stout St,Denver,CO,80205,DENVER COUNTY,Provides a variety of supportive housing options for youth experiencing homelessness. All youth have access to intensive strengths-based case management and have access to the following services and community partners:Education Employment Mental health Substance...,Eligibility: Youth aged 18 - 24 Area Served:Statewide,"Monday - Friday, 8 a.m. - 5 p.m. (Administrative ...",(303) 974-2900,http://urbanpeak.org/services#housing,39.7504559,-104.9866068
Homeless Youth/Teen Shelter,KARIS,362 Main St,Grand Junction,CO,81501,MESA COUNTY,"Offers a youth shelter that provides:10 bedsAssistance with transitioning towards stable and safe housing Case management services Support from advocates, volunteers and mentor...","Eligibility: Homeless, runaway and unaccompanied youth aged 13 - 20 years old Area Served:Mesa County","Monday - Friday, 11 a.m. - 4 p.m.",(970) 234-7004,http://thehousegj.org,39.0676234,-108.566324
Transitional Young Adult Living Program,KARIS,362 Main St,Grand Junction,CO,81501,MESA COUNTY,Provides two years of transitional housing across three different facilities for youth who do not have resources or are not ready to rent their own place...,Eligibility: Youth aged 18 - 23 for some facilities and youth aged 18 and under for Karis host homes Area Served:Mesa County,"Monday - Friday, 11 a.m. - 4 p.m.",(970) 234-7004,http://karisinc.org/,39.0676234,-108.566324
Reunification Services,ST FRANCIS CENTER,2323 Curtis Street,Denver,CO,81501,DENVER COUNTY,Assists individuals who are experiencing homelessness with locating family members and provides one-time financial assistance for travel to family members who are able to provide housing...,"Eligibility: Individuals who are experiencing homelessness, defined as: Staying in an emergency shelter Staying in a tent or car Stayin...","Monday, Tuesday, Thursday, Friday, 7 a.m. - 3 p.m...",(303) 297-1576,http://sfcdenver.org,39.7543166,-104.9860842
Day Center,GATHERING PLACE,1535 High St,Denver,CO,80218,DENVER COUNTY,Offers the following short-term services through a resource center:Shower Laundry facilities Assistance with Colorado IDs Food pantry Clothing Onsite computers 3 meals a da...,"Eligibility: Women, children, and transgender individuals as well as children 17 and younger that are accompanied by a legal guardia...","Monday, Wednesday - Friday, 8:30 a.m. - 5 p.m.; T...",(303) 321-4198,http://tgpdenver.org,39.740758,-104.9650989
