Assistance,Agency,Address,City,State,Zip,County,Services,Eligibility,Hours,Phone,Website,Latitude,Longitude
Overflow Cold Weather Shelter for Single Women and Families,CATHOLIC CHARITIES WELD COUNTY,1442 N 11th Ave,Greeley,CO,80631,WELD COUNTY,Provides a cold weather shelter for unhoused individuals.,Eligibility: Must be unhoused single women and families Area Served: Weld County,"Monday - Friday, 8:30 a.m. - 4:30 p.m.",(970) 353-3720,No Website Listed,40.4501919,-104.6965757
Transitional Housing for Homeless Women (Golden Girls Project),THE JOSEPH CENTER,2511 Belford Ave,Grand Junction,CO,81501,MESA COUNTY,"The Golden Girls project through The Joseph Center provides transitional housing for middle aged the elderly women 50+. While waiting for SSI/SSDI benefits, survivors benefits, securing employment, and securing permanent housing, Golden Girls can be housed...",Eligibility: For women age 50+ experiencing homelessness Area Served: Mesa County,"Monday - Friday, 9:00 am - 3:00 pm",(970) 314-9424,http://www.josephcentergj.com,39.0752859,-108.5361005
Day Shelter,AGAPE SAFE HAVEN,10656 Park Ridge Ave,Longmont,CO,80504,BOULDER COUNTY,Provides a day shelter where clients will be able to:Take a shower Wash clothing/belongings Eat a hot lunch Engage with staff and volunteer...,Eligibility: Must be:Aged 18-85 years old experiencing homelessness Sober Area Served:Boulder county,"Monday - Friday, 8 a.m. - 5 p.m.",(303) 774-7994,http://agapelongmont.org,40.2033408,-105.0978053
One-year Shelter for Sober Men,AGAPE SAFE HAVEN,10656 Park Ridge Ave,Longmont,CO,80504,BOULDER COUNTY,Offers a one-year-long shelter program for sober men experiencing homelessness.,Eligibility:  Clients must:Be a manBe aged 18-85 years old Be experiencing homelessness Be sober Area Served: Boulder county,"Monday - Friday, 8 a.m. - 5 p.m.",(303) 774-7994,http://agapelongmont.org,40.2033408,-105.0978053
Supportive Housing,NORTH RANGE BEHAVIORAL HEALTH,1300 N 17th Ave,Greeley,CO,80631,WELD COUNTY,Offers a continuum of clinical and residential options that serve a variety of needs arising from compounding mental health issues...,Eligibility: Individuals with substance use disorders or mental health concerns looking for recovery through stable housing Area Ser...,"Monday - Friday, 8 a.m. - 5 p.m.",(970) 347-2120 Ext 3,No Website Listed,40.449882,-104.700307
Overnight Shelter,CITY OF LOVELAND,300 S Railroad Ave,Loveland,CO,80537,LARIMER COUNTY,Provides an overnight shelter for people needing accommodation. Accommodations include: Tents with five beds Shower Toilets,Eligibility: Individuals aged 18 years and older Area Served:City of Loveland,"Monday - Sunday, 7 p.m. - 9 a.m.",(970) 962-3241,No Website Listed,40.390822,-105.076193
Overnight Shelter,HOPE HOMELESS OUTREACH,2000 Pike Rd,Longmont,CO,80501,BOULDER COUNTY,Provides an evening and overnight shelter to individuals seeking accommodations. Resources include: Showers Breakfast Dinner Also operates as a day shelter in extreme weather conditions...,Eligibility: Individuals aged 18 years and older and experiencing homelessness Area Served: Boulder County,"Sunday - Wednesday, 5:30 p.m. - 7:30 a.m.",(720) 453-6096,http://hopeforlongmont.org/programs/,40.1385988,-105.1264216
Overnight Shelter,HOPE HOMELESS OUTREACH,1335 Francis St,Longmont,CO,80501,BOULDER COUNTY,Provides an evening and overnight shelter to individuals seeking accommodations. Resources include: Showers Breakfast Dinner Also operates as a day shelter in extreme weather conditions...,Eligibility: Individuals aged 18 years and older and experiencing homelessness Area Served:Boulder County,"Thursday - Saturday, 5:30 p.m. - 7:30 a.m.",(720) 453-6096,http://hopeforlongmont.org/programs/,40.1820807,-105.117109
Day Center and OverAow Overnight Shelter,CITY OF LOVELAND,137 S Lincoln Ave,Loveland,CO,80537,LARIMER COUNTY,Provides those experiencing homelessness with access to resources and shelter. Services include: Showers Bathrooms Laundry Mail Locker storage Access to partner agencies that can assist with: Locating employment Obtaining government documents Accessing public benefit...,Eligibility: Individuals aged 18 and older who are seeking accommodation Area Served: City of Loveland,"Monday - Friday, 12 a.m. - 12 p.m.",(970) 962-2951,No Website Listed,40.3922533,-105.0733567
Transitional Housing for Women and Children,PROVIDENCE NETWORK,357 N Broadway,Denver,CO,80203,DENVER COUNTY,Provides a 2-year transitional housing program and wrap-around services for women with children who have experienced domestic violence...,"Eligibility: Women, aged 18 or older, with children who have experienced domestic violence Area Served: Statewide","Monday - Friday, 10 a.m. - 6 p.m.",(303) 860-8404,http://sites.google.com/providencenetwork.org/joyhouseorientation/home,39.721851,-104.987541
Short-Term Housing for Families,EMERGENCY FAMILY ASSISTANCE ASSOCIATION,1575 Yarmouth Ave,Boulder,CO,80304,BOULDER COUNTY,"Offers short-term housing, for up to 4 months, to single and two-parent families with minor children.",Eligibility: Single and two-parent families who are residents of Boulder County Area Served:Boulder County,"Monday, Wednesday, Friday, 12 p.m. - 4:30 p.m.; T...",(303) 442-3042,http://efaa.org,40.058333,-105.2778705
Homeless & Runaway Youth Services,MORGAN COUNTY INTERAGENCY OVERSIGHT GROUP,815 W Platte Ave,Fort Morgan,CO,80701,MORGAN COUNTY,Provides services to unaccompanied homeless/runaway youth. Services include: Food Clothing Hygiene items,Eligibility: Unaccompanied youth aged 12-18 years Area Served: Morgan County,"Monday - Friday, 8 a.m. - 5 p.m.",(970) 467-4214,http://morgancountyiog.com,40.2540921,-103.8121917
Transitional Housing,MATER FILIUS COLORADO SPRINGS,8773 Scarborough Dr,Colorado Springs,CO,80920,EL PASO COUNTY,"Offers transitional housing and related services, including: Assistance with healthcare appointments Transportation Spiritual care Nutritious self-prepared meals Access to child enrichmen...",Eligibility: Pregnant teenagers and women with children aged 5 and under Area Served: El Paso County,24 hours/7 days a week,(719) 900-2801,http://matercliuscs.org,38.9596157,-104.7391191
Supportive Housing,CASA OF THE 7TH JUDICIAL DISTRICT,147 N Townsend Ave,Montrose,CO,81401,MONTROSE COUNTY,Provides housing for youth in need of a permanent home.,Eligibility: Youth aged 18-24 years who are emancipating from foster care or are at immediate risk of homelessness Area Served: Montr...,"Monday - Friday, 8 a.m. - 5 p.m.",(970) 249-0337,http://casa7jd.org/supportive-housing,38.4799461,-107.8789224
Shelter for Families with Children,FAMILY TREE,14991 E Oxford Ave,Aurora,CO,80014,ARAPAHOE COUNTY,"Provides housing for families experiencing homelessness. The Generational Opportunities to Achieve Long-term Success (GOALS) program offered at the shelter also provides:No-cost access to: Food and meals Laundry facilities Personal care items A dedicated case manager to work individually with client households On-site and round-the-clock stahngAn early childhood education center for children and partnerships with Head Start and other early childhood programsPostsecondary adult education support and other pathways to employment Employment services, including: Soft skills training Computer training Career preparation Access to professional clothing Post-employment support to help sustain long-term employment Services and assistance that encourages building social networks within and outside the program On-site classes in parenting, finance and substance use peer groups Referrals for: Health careSpecialty careDental care Mental health careSubstance abuse treatment Partnership connections for academic tutoring to help school-age children with schoolwork and other academic needs...",Eligibility: Households with youth aged 17 and under in the service area Area Served: City of Aurora; Arapahoe County,24 hours/7 days a week,(303) 693-1241,http://thefamilytree.org/goals,39.644862,-104.8133638
Drop-In Center for Individuals Experiencing Homelessness,GIVING HEART ENGLEWOOD,4358 S Broadway,Englewood,CO,80113,ARAPAHOE COUNTY,Provides a drop-in resource center for individuals experiencing homelessness. Services include: Laundry Showers Mailing address Computer and internet access Clothing Basic hygiene items Certificate and forms assistance with items such as: IDs Birth certificates Death certificates Social Security cards Medicaid Activities and classes Job readiness Referrals to community partner...,Eligibility: Individuals aged 16 years and older who are experiencing homelessness Area Served: Arapahoe County; City of Englewood,"Tuesday, Thursday, 10 a.m. - 3 p.m.",(720) 460-0953,http://givingheartenglewood.com,39.6375067,-104.9877261
"Drop-In Services for Single Men, Single Women, and Families",DENVER RESCUE MISSION,1130 Park Ave W,Denver,CO,80205,DENVER COUNTY,"Offers: BreakfastLunchDinnerShowers (must sign up)Laundry (must sign up)Socks Underwear Toiletries, such as: Toothbrushes Toothpaste Combs Feminine hygiene products Outdoor courtyard space to stay in during the da...",Eligibility: No restrictions applied Area Served:Statewide,"Monday - Sunday, 6 p.m. - 5:30 a.m. (Overnight Sh...",(303) 294-0157,http://denverrescuemission.org/who-we-are/locations/lawrence-street-community-center,39.7547589,-104.9879997
Day Shelter,ALL ROADS SHELTER,4869 Broadway,Boulder,CO,80304,BOULDER COUNTY,Provides a day shelter that offers access to the following: Bathrooms Showers Laundry Food Lockers Mail Phone access Case management Vital document access Medical and mental health services Community court Reentry programs Peer support Benefit assistance Employment service...,Eligibility: Individuals aged 18 and older experiencing homelessness Area Served:Boulder County,"Monday - Sunday, Hours Vary",(303) 442-4646 (tel:(303) 442-4646),http://allroadsboco.org/day-services/,40.0625882,-105.282615
